{
  "counts": {
    "aten.__and__.Tensor": 2,
    "aten._assert_tensor_metadata.default": 9,
    "aten._to_copy.default": 4,
    "aten.abs.default": 1,
    "aten.add.Tensor": 13,
    "aten.arange.default": 5,
    "aten.clone.default": 8,
    "aten.div.Tensor": 2,
    "aten.embedding.default": 2,
    "aten.expand.default": 1,
    "aten.full_like.default": 1,
    "aten.ge.Scalar": 1,
    "aten.gt.Scalar": 1,
    "aten.index.Tensor": 1,
    "aten.linear.default": 6,
    "aten.log.default": 1,
    "aten.lt.Scalar": 1,
    "aten.matmul.default": 2,
    "aten.mean.dim": 3,
    "aten.min.other": 1,
    "aten.mul.Tensor": 9,
    "aten.new_ones.default": 1,
    "aten.permute.default": 1,
    "aten.pow.Tensor_Scalar": 3,
    "aten.relu.default": 1,
    "aten.rsqrt.default": 3,
    "aten.softmax.int": 1,
    "aten.sub.Tensor": 1,
    "aten.transpose.int": 5,
    "aten.unsqueeze.default": 12,
    "aten.view.default": 4,
    "aten.where.ScalarOther": 1,
    "aten.where.self": 1
  },
  "dialect": "functional",
  "graph_sha256": "61f8351810f91d678b7f9b6ab24addb4ed47963f1bd6365a1d65d41eec268016",
  "ops": [
    [
      "aten.__and__.Tensor",
      {
        "out_dtype": "bool",
        "out_rank": 4
      },
      2
    ],
    [
      "aten._to_copy.default",
      {
        "dtype": "torch.bool",
        "memory_format": null,
        "non_blocking": false,
        "out_dtype": "bool",
        "out_rank": 2
      },
      1
    ],
    [
      "aten._to_copy.default",
      {
        "dtype": "torch.float32",
        "memory_format": null,
        "non_blocking": false,
        "out_dtype": "f32",
        "out_rank": 2
      },
      1
    ],
    [
      "aten._to_copy.default",
      {
        "dtype": "torch.int64",
        "memory_format": null,
        "non_blocking": false,
        "out_dtype": "i64",
        "out_rank": 2
      },
      2
    ],
    [
      "aten.abs.default",
      {
        "out_dtype": "i64",
        "out_rank": 2
      },
      1
    ],
    [
      "aten.add.Tensor",
      {
        "alpha": 1,
        "out_dtype": "f32",
        "out_rank": 3
      },
      5
    ],
    [
      "aten.add.Tensor",
      {
        "alpha": 1,
        "out_dtype": "f32",
        "out_rank": 4
      },
      2
    ],
    [
      "aten.add.Tensor",
      {
        "alpha": 1,
        "out_dtype": "i64",
        "out_rank": 1
      },
      2
    ],
    [
      "aten.add.Tensor",
      {
        "alpha": 1,
        "out_dtype": "i64",
        "out_rank": 2
      },
      4
    ],
    [
      "aten.arange.default",
      {
        "dtype": "torch.int64",
        "end": 16,
        "out_dtype": "i64",
        "out_rank": 1
      },
      2
    ],
    [
      "aten.arange.default",
      {
        "dtype": null,
        "end": 1,
        "out_dtype": "i64",
        "out_rank": 1
      },
      1
    ],
    [
      "aten.arange.default",
      {
        "dtype": null,
        "end": 16,
        "out_dtype": "i64",
        "out_rank": 1
      },
      2
    ],
    [
      "aten.clone.default",
      {
        "memory_format": "torch.contiguous_format",
        "out_dtype": "f32",
        "out_rank": 4
      },
      1
    ],
    [
      "aten.clone.default",
      {
        "memory_format": null,
        "out_dtype": "f32",
        "out_rank": 0
      },
      1
    ],
    [
      "aten.clone.default",
      {
        "memory_format": null,
        "out_dtype": "f32",
        "out_rank": 3
      },
      5
    ],
    [
      "aten.clone.default",
      {
        "memory_format": null,
        "out_dtype": "f32",
        "out_rank": 4
      },
      1
    ],
    [
      "aten.div.Tensor",
      {
        "out_dtype": "f32",
        "out_rank": 2
      },
      2
    ],
    [
      "aten.embedding.default",
      {
        "out_dtype": "f32",
        "out_rank": 3,
        "padding_idx": -1,
        "scale_grad_by_freq": false,
        "sparse": false
      },
      2
    ],
    [
      "aten.expand.default",
      {
        "implicit": false,
        "out_dtype": "bool",
        "out_rank": 4,
        "size": [
          1,
          -1,
          16,
          16
        ]
      },
      1
    ],
    [
      "aten.full_like.default",
      {
        "dtype": null,
        "fill_value": 15,
        "memory_format": null,
        "out_dtype": "i64",
        "out_rank": 2
      },
      1
    ],
    [
      "aten.ge.Scalar",
      {
        "other": 0,
        "out_dtype": "bool",
        "out_rank": 4
      },
      1
    ],
    [
      "aten.gt.Scalar",
      {
        "other": 0,
        "out_dtype": "bool",
        "out_rank": 2
      },
      1
    ],
    [
      "aten.index.Tensor",
      {
        "out_dtype": "bool",
        "out_rank": 4
      },
      1
    ],
    [
      "aten.linear.default",
      {
        "out_dtype": "f32",
        "out_rank": 3
      },
      6
    ],
    [
      "aten.log.default",
      {
        "out_dtype": "f32",
        "out_rank": 2
      },
      1
    ],
    [
      "aten.lt.Scalar",
      {
        "other": 8,
        "out_dtype": "bool",
        "out_rank": 2
      },
      1
    ],
    [
      "aten.matmul.default",
      {
        "out_dtype": "f32",
        "out_rank": 4
      },
      2
    ],
    [
      "aten.mean.dim",
      {
        "dim": [
          -1
        ],
        "dtype": null,
        "keepdim": true,
        "out_dtype": "f32",
        "out_rank": 3
      },
      3
    ],
    [
      "aten.min.other",
      {
        "out_dtype": "i64",
        "out_rank": 2
      },
      1
    ],
    [
      "aten.mul.Tensor",
      {
        "out_dtype": "f32",
        "out_rank": 2
      },
      1
    ],
    [
      "aten.mul.Tensor",
      {
        "out_dtype": "f32",
        "out_rank": 3
      },
      6
    ],
    [
      "aten.mul.Tensor",
      {
        "out_dtype": "f32",
        "out_rank": 4
      },
      1
    ],
    [
      "aten.mul.Tensor",
      {
        "out_dtype": "i64",
        "out_rank": 2
      },
      1
    ],
    [
      "aten.new_ones.default",
      {
        "dtype": "torch.bool",
        "out_dtype": "bool",
        "out_rank": 0,
        "size": []
      },
      1
    ],
    [
      "aten.permute.default",
      {
        "dims": [
          2,
          0,
          1
        ],
        "out_dtype": "f32",
        "out_rank": 3
      },
      1
    ],
    [
      "aten.pow.Tensor_Scalar",
      {
        "exponent": 2,
        "out_dtype": "f32",
        "out_rank": 3
      },
      3
    ],
    [
      "aten.relu.default",
      {
        "out_dtype": "f32",
        "out_rank": 3
      },
      1
    ],
    [
      "aten.rsqrt.default",
      {
        "out_dtype": "f32",
        "out_rank": 3
      },
      3
    ],
    [
      "aten.softmax.int",
      {
        "dim": -1,
        "dtype": null,
        "out_dtype": "f32",
        "out_rank": 4
      },
      1
    ],
    [
      "aten.sub.Tensor",
      {
        "alpha": 1,
        "out_dtype": "i64",
        "out_rank": 2
      },
      1
    ],
    [
      "aten.transpose.int",
      {
        "dim0": 1,
        "dim1": 2,
        "out_dtype": "f32",
        "out_rank": 4
      },
      4
    ],
    [
      "aten.transpose.int",
      {
        "dim0": 2,
        "dim1": 3,
        "out_dtype": "f32",
        "out_rank": 4
      },
      1
    ],
    [
      "aten.unsqueeze.default",
      {
        "dim": 0,
        "out_dtype": "f32",
        "out_rank": 4
      },
      1
    ],
    [
      "aten.unsqueeze.default",
      {
        "dim": 0,
        "out_dtype": "i64",
        "out_rank": 2
      },
      3
    ],
    [
      "aten.unsqueeze.default",
      {
        "dim": 1,
        "out_dtype": "i64",
        "out_rank": 2
      },
      2
    ],
    [
      "aten.unsqueeze.default",
      {
        "dim": 1,
        "out_dtype": "i64",
        "out_rank": 3
      },
      2
    ],
    [
      "aten.unsqueeze.default",
      {
        "dim": 2,
        "out_dtype": "i64",
        "out_rank": 3
      },
      1
    ],
    [
      "aten.unsqueeze.default",
      {
        "dim": 2,
        "out_dtype": "i64",
        "out_rank": 4
      },
      1
    ],
    [
      "aten.unsqueeze.default",
      {
        "dim": 3,
        "out_dtype": "i64",
        "out_rank": 4
      },
      2
    ],
    [
      "aten.view.default",
      {
        "out_dtype": "f32",
        "out_rank": 3,
        "size": [
          1,
          16,
          -1
        ]
      },
      1
    ],
    [
      "aten.view.default",
      {
        "out_dtype": "f32",
        "out_rank": 4,
        "size": [
          1,
          16,
          -1,
          32
        ]
      },
      3
    ],
    [
      "aten.where.ScalarOther",
      {
        "other": -3.4028234663852886e+38,
        "out_dtype": "f32",
        "out_rank": 4
      },
      1
    ],
    [
      "aten.where.self",
      {
        "out_dtype": "i64",
        "out_rank": 2
      },
      1
    ]
  ],
  "schema_version": 1
}
