{
  "counts": {
    "aten._assert_tensor_metadata.default": 2,
    "aten.add.Tensor": 8,
    "aten.arange.default": 1,
    "aten.cat.default": 1,
    "aten.clone.default": 10,
    "aten.conv2d.default": 1,
    "aten.expand.default": 2,
    "aten.ge.Scalar": 1,
    "aten.gelu.default": 2,
    "aten.layer_norm.default": 5,
    "aten.linear.default": 13,
    "aten.matmul.default": 4,
    "aten.mul.Tensor": 2,
    "aten.select.int": 1,
    "aten.softmax.int": 2,
    "aten.transpose.int": 11,
    "aten.unsqueeze.default": 3,
    "aten.view.default": 9,
    "aten.where.ScalarOther": 1
  },
  "dialect": "functional",
  "graph_sha256": "d78c8544a8336fe9e46137076f73cb5feda28d6a59f816d58beca95cc9763d4a",
  "ops": [
    [
      "aten.add.Tensor",
      {
        "alpha": 1,
        "out_dtype": "f32",
        "out_rank": 3
      },
      5
    ],
    [
      "aten.add.Tensor",
      {
        "alpha": 1,
        "out_dtype": "f32",
        "out_rank": 4
      },
      2
    ],
    [
      "aten.add.Tensor",
      {
        "alpha": 1,
        "out_dtype": "i64",
        "out_rank": 1
      },
      1
    ],
    [
      "aten.arange.default",
      {
        "dtype": null,
        "end": 17,
        "out_dtype": "i64",
        "out_rank": 1
      },
      1
    ],
    [
      "aten.cat.default",
      {
        "dim": 1,
        "out_dtype": "f32",
        "out_rank": 3
      },
      1
    ],
    [
      "aten.clone.default",
      {
        "memory_format": "torch.contiguous_format",
        "out_dtype": "f32",
        "out_rank": 4
      },
      2
    ],
    [
      "aten.clone.default",
      {
        "memory_format": null,
        "out_dtype": "f32",
        "out_rank": 0
      },
      1
    ],
    [
      "aten.clone.default",
      {
        "memory_format": null,
        "out_dtype": "f32",
        "out_rank": 3
      },
      5
    ],
    [
      "aten.clone.default",
      {
        "memory_format": null,
        "out_dtype": "f32",
        "out_rank": 4
      },
      2
    ],
    [
      "aten.conv2d.default",
      {
        "depthwise": false,
        "dilation": [
          1,
          1
        ],
        "groups": 1,
        "kernel": [
          8,
          8
        ],
        "out_dtype": "f32",
        "out_rank": 4,
        "padding": [
          0,
          0
        ],
        "stride": [
          8,
          8
        ]
      },
      1
    ],
    [
      "aten.expand.default",
      {
        "implicit": false,
        "out_dtype": "bool",
        "out_rank": 4,
        "size": [
          1,
          -1,
          17,
          17
        ]
      },
      1
    ],
    [
      "aten.expand.default",
      {
        "implicit": false,
        "out_dtype": "f32",
        "out_rank": 3,
        "size": [
          1,
          -1,
          -1
        ]
      },
      1
    ],
    [
      "aten.ge.Scalar",
      {
        "other": 0,
        "out_dtype": "bool",
        "out_rank": 4
      },
      1
    ],
    [
      "aten.gelu.default",
      {
        "approximate": "none",
        "out_dtype": "f32",
        "out_rank": 3
      },
      2
    ],
    [
      "aten.layer_norm.default",
      {
        "cudnn_enable": false,
        "eps": 1e-12,
        "normalized_shape": [
          32
        ],
        "out_dtype": "f32",
        "out_rank": 3
      },
      5
    ],
    [
      "aten.linear.default",
      {
        "out_dtype": "f32",
        "out_rank": 2
      },
      1
    ],
    [
      "aten.linear.default",
      {
        "out_dtype": "f32",
        "out_rank": 3
      },
      12
    ],
    [
      "aten.matmul.default",
      {
        "out_dtype": "f32",
        "out_rank": 4
      },
      4
    ],
    [
      "aten.mul.Tensor",
      {
        "out_dtype": "f32",
        "out_rank": 4
      },
      2
    ],
    [
      "aten.select.int",
      {
        "dim": 1,
        "index": 0,
        "out_dtype": "f32",
        "out_rank": 2
      },
      1
    ],
    [
      "aten.softmax.int",
      {
        "dim": -1,
        "dtype": "torch.float32",
        "out_dtype": "f32",
        "out_rank": 4
      },
      2
    ],
    [
      "aten.transpose.int",
      {
        "dim0": 1,
        "dim1": 2,
        "out_dtype": "f32",
        "out_rank": 3
      },
      1
    ],
    [
      "aten.transpose.int",
      {
        "dim0": 1,
        "dim1": 2,
        "out_dtype": "f32",
        "out_rank": 4
      },
      8
    ],
    [
      "aten.transpose.int",
      {
        "dim0": 2,
        "dim1": 3,
        "out_dtype": "f32",
        "out_rank": 4
      },
      2
    ],
    [
      "aten.unsqueeze.default",
      {
        "dim": 0,
        "out_dtype": "i64",
        "out_rank": 2
      },
      1
    ],
    [
      "aten.unsqueeze.default",
      {
        "dim": 1,
        "out_dtype": "i64",
        "out_rank": 3
      },
      1
    ],
    [
      "aten.unsqueeze.default",
      {
        "dim": 3,
        "out_dtype": "i64",
        "out_rank": 4
      },
      1
    ],
    [
      "aten.view.default",
      {
        "out_dtype": "f32",
        "out_rank": 3,
        "size": [
          1,
          17,
          -1
        ]
      },
      2
    ],
    [
      "aten.view.default",
      {
        "out_dtype": "f32",
        "out_rank": 3,
        "size": [
          1,
          32,
          16
        ]
      },
      1
    ],
    [
      "aten.view.default",
      {
        "out_dtype": "f32",
        "out_rank": 4,
        "size": [
          1,
          17,
          -1,
          8
        ]
      },
      6
    ],
    [
      "aten.where.ScalarOther",
      {
        "other": -3.4028234663852886e+38,
        "out_dtype": "f32",
        "out_rank": 4
      },
      1
    ]
  ],
  "schema_version": 1
}
