{
  "counts": {
    "aten._assert_tensor_metadata.default": 2,
    "aten.add.Tensor": 3,
    "aten.cat.default": 1,
    "aten.clone.default": 2,
    "aten.conv2d.default": 1,
    "aten.embedding.default": 1,
    "aten.expand.default": 1,
    "aten.layer_norm.default": 4,
    "aten.linear.default": 7,
    "aten.matmul.default": 2,
    "aten.mul.Tensor": 3,
    "aten.select.int": 1,
    "aten.sigmoid.default": 1,
    "aten.softmax.int": 1,
    "aten.transpose.int": 6,
    "aten.view.default": 5
  },
  "dialect": "functional",
  "graph_sha256": "986eb84ed4bc900e79e7f9220b1cc0e183c41f6746f3bf264d6c1e83b2eebfee",
  "ops": [
    [
      "aten.add.Tensor",
      {
        "alpha": 1,
        "out_dtype": "f32",
        "out_rank": 3
      },
      3
    ],
    [
      "aten.cat.default",
      {
        "dim": 1,
        "out_dtype": "f32",
        "out_rank": 3
      },
      1
    ],
    [
      "aten.clone.default",
      {
        "memory_format": "torch.contiguous_format",
        "out_dtype": "f32",
        "out_rank": 4
      },
      1
    ],
    [
      "aten.clone.default",
      {
        "memory_format": null,
        "out_dtype": "f32",
        "out_rank": 4
      },
      1
    ],
    [
      "aten.conv2d.default",
      {
        "depthwise": false,
        "dilation": [
          1,
          1
        ],
        "groups": 1,
        "kernel": [
          16,
          16
        ],
        "out_dtype": "f32",
        "out_rank": 4,
        "padding": [
          0,
          0
        ],
        "stride": [
          16,
          16
        ]
      },
      1
    ],
    [
      "aten.embedding.default",
      {
        "out_dtype": "f32",
        "out_rank": 3,
        "padding_idx": -1,
        "scale_grad_by_freq": false,
        "sparse": false
      },
      1
    ],
    [
      "aten.expand.default",
      {
        "implicit": false,
        "out_dtype": "f32",
        "out_rank": 3,
        "size": [
          1,
          1,
          -1
        ]
      },
      1
    ],
    [
      "aten.layer_norm.default",
      {
        "cudnn_enable": false,
        "eps": 1e-05,
        "normalized_shape": [
          64
        ],
        "out_dtype": "f32",
        "out_rank": 2
      },
      1
    ],
    [
      "aten.layer_norm.default",
      {
        "cudnn_enable": false,
        "eps": 1e-05,
        "normalized_shape": [
          64
        ],
        "out_dtype": "f32",
        "out_rank": 3
      },
      3
    ],
    [
      "aten.linear.default",
      {
        "out_dtype": "f32",
        "out_rank": 2
      },
      1
    ],
    [
      "aten.linear.default",
      {
        "out_dtype": "f32",
        "out_rank": 3
      },
      6
    ],
    [
      "aten.matmul.default",
      {
        "out_dtype": "f32",
        "out_rank": 4
      },
      2
    ],
    [
      "aten.mul.Tensor",
      {
        "out_dtype": "f32",
        "out_rank": 3
      },
      2
    ],
    [
      "aten.mul.Tensor",
      {
        "out_dtype": "f32",
        "out_rank": 4
      },
      1
    ],
    [
      "aten.select.int",
      {
        "dim": 1,
        "index": 0,
        "out_dtype": "f32",
        "out_rank": 2
      },
      1
    ],
    [
      "aten.sigmoid.default",
      {
        "out_dtype": "f32",
        "out_rank": 3
      },
      1
    ],
    [
      "aten.softmax.int",
      {
        "dim": -1,
        "dtype": "torch.float32",
        "out_dtype": "f32",
        "out_rank": 4
      },
      1
    ],
    [
      "aten.transpose.int",
      {
        "dim0": -1,
        "dim1": -2,
        "out_dtype": "f32",
        "out_rank": 4
      },
      1
    ],
    [
      "aten.transpose.int",
      {
        "dim0": 1,
        "dim1": 2,
        "out_dtype": "f32",
        "out_rank": 3
      },
      1
    ],
    [
      "aten.transpose.int",
      {
        "dim0": 1,
        "dim1": 2,
        "out_dtype": "f32",
        "out_rank": 4
      },
      4
    ],
    [
      "aten.view.default",
      {
        "out_dtype": "f32",
        "out_rank": 3,
        "size": [
          1,
          5,
          -1
        ]
      },
      1
    ],
    [
      "aten.view.default",
      {
        "out_dtype": "f32",
        "out_rank": 3,
        "size": [
          1,
          64,
          4
        ]
      },
      1
    ],
    [
      "aten.view.default",
      {
        "out_dtype": "f32",
        "out_rank": 4,
        "size": [
          1,
          5,
          -1,
          32
        ]
      },
      3
    ]
  ],
  "schema_version": 1
}
