{
  "counts": {
    "aten._assert_tensor_metadata.default": 1,
    "aten._weight_norm.default": 1,
    "aten.add.Tensor": 5,
    "aten.arange.default": 1,
    "aten.clone.default": 9,
    "aten.conv1d.default": 4,
    "aten.expand.default": 1,
    "aten.ge.Scalar": 1,
    "aten.gelu.default": 5,
    "aten.group_norm.default": 1,
    "aten.layer_norm.default": 4,
    "aten.linear.default": 8,
    "aten.matmul.default": 2,
    "aten.mul.Tensor": 1,
    "aten.slice.Tensor": 1,
    "aten.softmax.int": 1,
    "aten.transpose.int": 8,
    "aten.unsqueeze.default": 4,
    "aten.view.default": 4,
    "aten.where.ScalarOther": 1
  },
  "dialect": "functional",
  "graph_sha256": "fa5875e47c8369690f167c4a8d3c6d6e9431efa057486c8506a05298f6ca8303",
  "ops": [
    [
      "aten._weight_norm.default",
      {
        "dim": 2,
        "out_dtype": "f32",
        "out_rank": 3
      },
      1
    ],
    [
      "aten.add.Tensor",
      {
        "alpha": 1,
        "out_dtype": "f32",
        "out_rank": 3
      },
      3
    ],
    [
      "aten.add.Tensor",
      {
        "alpha": 1,
        "out_dtype": "f32",
        "out_rank": 4
      },
      1
    ],
    [
      "aten.add.Tensor",
      {
        "alpha": 1,
        "out_dtype": "i64",
        "out_rank": 1
      },
      1
    ],
    [
      "aten.arange.default",
      {
        "dtype": null,
        "end": 50,
        "out_dtype": "i64",
        "out_rank": 1
      },
      1
    ],
    [
      "aten.clone.default",
      {
        "memory_format": "torch.contiguous_format",
        "out_dtype": "f32",
        "out_rank": 4
      },
      1
    ],
    [
      "aten.clone.default",
      {
        "memory_format": null,
        "out_dtype": "f32",
        "out_rank": 0
      },
      1
    ],
    [
      "aten.clone.default",
      {
        "memory_format": null,
        "out_dtype": "f32",
        "out_rank": 3
      },
      6
    ],
    [
      "aten.clone.default",
      {
        "memory_format": null,
        "out_dtype": "f32",
        "out_rank": 4
      },
      1
    ],
    [
      "aten.conv1d.default",
      {
        "depthwise": false,
        "dilation": [
          1
        ],
        "groups": 1,
        "kernel": [
          10
        ],
        "out_dtype": "f32",
        "out_rank": 3,
        "padding": [
          0
        ],
        "stride": [
          5
        ]
      },
      1
    ],
    [
      "aten.conv1d.default",
      {
        "depthwise": false,
        "dilation": [
          1
        ],
        "groups": 1,
        "kernel": [
          3
        ],
        "out_dtype": "f32",
        "out_rank": 3,
        "padding": [
          0
        ],
        "stride": [
          2
        ]
      },
      2
    ],
    [
      "aten.conv1d.default",
      {
        "depthwise": false,
        "dilation": [
          1
        ],
        "groups": 2,
        "kernel": [
          16
        ],
        "out_dtype": "f32",
        "out_rank": 3,
        "padding": [
          8
        ],
        "stride": [
          1
        ]
      },
      1
    ],
    [
      "aten.expand.default",
      {
        "implicit": false,
        "out_dtype": "bool",
        "out_rank": 4,
        "size": [
          1,
          -1,
          50,
          50
        ]
      },
      1
    ],
    [
      "aten.ge.Scalar",
      {
        "other": 0,
        "out_dtype": "bool",
        "out_rank": 4
      },
      1
    ],
    [
      "aten.gelu.default",
      {
        "approximate": "none",
        "out_dtype": "f32",
        "out_rank": 3
      },
      5
    ],
    [
      "aten.group_norm.default",
      {
        "cudnn_enabled": false,
        "eps": 1e-05,
        "num_groups": 16,
        "out_dtype": "f32",
        "out_rank": 3
      },
      1
    ],
    [
      "aten.layer_norm.default",
      {
        "cudnn_enable": false,
        "eps": 1e-05,
        "normalized_shape": [
          16
        ],
        "out_dtype": "f32",
        "out_rank": 3
      },
      1
    ],
    [
      "aten.layer_norm.default",
      {
        "cudnn_enable": false,
        "eps": 1e-05,
        "normalized_shape": [
          32
        ],
        "out_dtype": "f32",
        "out_rank": 3
      },
      3
    ],
    [
      "aten.linear.default",
      {
        "out_dtype": "f32",
        "out_rank": 3
      },
      8
    ],
    [
      "aten.matmul.default",
      {
        "out_dtype": "f32",
        "out_rank": 4
      },
      2
    ],
    [
      "aten.mul.Tensor",
      {
        "out_dtype": "f32",
        "out_rank": 4
      },
      1
    ],
    [
      "aten.slice.Tensor",
      {
        "dim": 2,
        "end": -1,
        "out_dtype": "f32",
        "out_rank": 3,
        "start": 0,
        "step": 1
      },
      1
    ],
    [
      "aten.softmax.int",
      {
        "dim": -1,
        "dtype": null,
        "out_dtype": "f32",
        "out_rank": 4
      },
      1
    ],
    [
      "aten.transpose.int",
      {
        "dim0": 1,
        "dim1": 2,
        "out_dtype": "f32",
        "out_rank": 3
      },
      3
    ],
    [
      "aten.transpose.int",
      {
        "dim0": 1,
        "dim1": 2,
        "out_dtype": "f32",
        "out_rank": 4
      },
      4
    ],
    [
      "aten.transpose.int",
      {
        "dim0": 2,
        "dim1": 3,
        "out_dtype": "f32",
        "out_rank": 4
      },
      1
    ],
    [
      "aten.unsqueeze.default",
      {
        "dim": 0,
        "out_dtype": "i64",
        "out_rank": 2
      },
      1
    ],
    [
      "aten.unsqueeze.default",
      {
        "dim": 1,
        "out_dtype": "f32",
        "out_rank": 3
      },
      1
    ],
    [
      "aten.unsqueeze.default",
      {
        "dim": 1,
        "out_dtype": "i64",
        "out_rank": 3
      },
      1
    ],
    [
      "aten.unsqueeze.default",
      {
        "dim": 3,
        "out_dtype": "i64",
        "out_rank": 4
      },
      1
    ],
    [
      "aten.view.default",
      {
        "out_dtype": "f32",
        "out_rank": 3,
        "size": [
          1,
          50,
          -1
        ]
      },
      1
    ],
    [
      "aten.view.default",
      {
        "out_dtype": "f32",
        "out_rank": 4,
        "size": [
          1,
          50,
          -1,
          16
        ]
      },
      3
    ],
    [
      "aten.where.ScalarOther",
      {
        "other": -3.4028234663852886e+38,
        "out_dtype": "f32",
        "out_rank": 4
      },
      1
    ]
  ],
  "schema_version": 1
}
