{
  "counts": {
    "aten.__and__.Tensor": 6,
    "aten._assert_tensor_metadata.default": 9,
    "aten._to_copy.default": 3,
    "aten.add.Tensor": 33,
    "aten.arange.default": 10,
    "aten.arange.start": 1,
    "aten.clone.default": 43,
    "aten.embedding.default": 4,
    "aten.expand.default": 3,
    "aten.ge.Scalar": 2,
    "aten.index.Tensor": 3,
    "aten.layer_norm.default": 15,
    "aten.le.Tensor": 1,
    "aten.linear.default": 47,
    "aten.matmul.default": 16,
    "aten.mul.Tensor": 10,
    "aten.new_ones.default": 3,
    "aten.silu.default": 7,
    "aten.softmax.int": 8,
    "aten.transpose.int": 40,
    "aten.unsqueeze.default": 27,
    "aten.view.default": 32,
    "aten.where.ScalarOther": 3
  },
  "dialect": "functional",
  "graph_sha256": "ec041ff0295f5056da057f802fb2c2075efc313ba3af888fab13bc066e3818dc",
  "ops": [
    [
      "aten.__and__.Tensor",
      {
        "out_dtype": "bool",
        "out_rank": 4
      },
      6
    ],
    [
      "aten._to_copy.default",
      {
        "dtype": "torch.bool",
        "memory_format": null,
        "non_blocking": false,
        "out_dtype": "bool",
        "out_rank": 2
      },
      3
    ],
    [
      "aten.add.Tensor",
      {
        "alpha": 1,
        "out_dtype": "f32",
        "out_rank": 3
      },
      18
    ],
    [
      "aten.add.Tensor",
      {
        "alpha": 1,
        "out_dtype": "f32",
        "out_rank": 4
      },
      8
    ],
    [
      "aten.add.Tensor",
      {
        "alpha": 1,
        "out_dtype": "i64",
        "out_rank": 1
      },
      7
    ],
    [
      "aten.arange.default",
      {
        "dtype": null,
        "end": 1,
        "out_dtype": "i64",
        "out_rank": 1
      },
      3
    ],
    [
      "aten.arange.default",
      {
        "dtype": null,
        "end": 16,
        "out_dtype": "i64",
        "out_rank": 1
      },
      3
    ],
    [
      "aten.arange.default",
      {
        "dtype": null,
        "end": 4,
        "out_dtype": "i64",
        "out_rank": 1
      },
      4
    ],
    [
      "aten.arange.start",
      {
        "dtype": "torch.int64",
        "end": 16,
        "out_dtype": "i64",
        "out_rank": 1,
        "start": 0
      },
      1
    ],
    [
      "aten.clone.default",
      {
        "memory_format": "torch.contiguous_format",
        "out_dtype": "f32",
        "out_rank": 4
      },
      8
    ],
    [
      "aten.clone.default",
      {
        "memory_format": null,
        "out_dtype": "f32",
        "out_rank": 0
      },
      3
    ],
    [
      "aten.clone.default",
      {
        "memory_format": null,
        "out_dtype": "f32",
        "out_rank": 3
      },
      24
    ],
    [
      "aten.clone.default",
      {
        "memory_format": null,
        "out_dtype": "f32",
        "out_rank": 4
      },
      8
    ],
    [
      "aten.embedding.default",
      {
        "out_dtype": "f32",
        "out_rank": 2,
        "padding_idx": -1,
        "scale_grad_by_freq": false,
        "sparse": false
      },
      2
    ],
    [
      "aten.embedding.default",
      {
        "out_dtype": "f32",
        "out_rank": 3,
        "padding_idx": 0,
        "scale_grad_by_freq": false,
        "sparse": false
      },
      2
    ],
    [
      "aten.expand.default",
      {
        "implicit": false,
        "out_dtype": "bool",
        "out_rank": 4,
        "size": [
          1,
          -1,
          16,
          16
        ]
      },
      1
    ],
    [
      "aten.expand.default",
      {
        "implicit": false,
        "out_dtype": "bool",
        "out_rank": 4,
        "size": [
          1,
          -1,
          4,
          16
        ]
      },
      1
    ],
    [
      "aten.expand.default",
      {
        "implicit": false,
        "out_dtype": "bool",
        "out_rank": 4,
        "size": [
          1,
          -1,
          4,
          4
        ]
      },
      1
    ],
    [
      "aten.ge.Scalar",
      {
        "other": 0,
        "out_dtype": "bool",
        "out_rank": 4
      },
      2
    ],
    [
      "aten.index.Tensor",
      {
        "out_dtype": "bool",
        "out_rank": 4
      },
      3
    ],
    [
      "aten.layer_norm.default",
      {
        "cudnn_enable": false,
        "eps": 1e-05,
        "normalized_shape": [
          32
        ],
        "out_dtype": "f32",
        "out_rank": 3
      },
      15
    ],
    [
      "aten.le.Tensor",
      {
        "out_dtype": "bool",
        "out_rank": 4
      },
      1
    ],
    [
      "aten.linear.default",
      {
        "out_dtype": "f32",
        "out_rank": 3
      },
      47
    ],
    [
      "aten.matmul.default",
      {
        "out_dtype": "f32",
        "out_rank": 4
      },
      16
    ],
    [
      "aten.mul.Tensor",
      {
        "out_dtype": "f32",
        "out_rank": 3
      },
      2
    ],
    [
      "aten.mul.Tensor",
      {
        "out_dtype": "f32",
        "out_rank": 4
      },
      8
    ],
    [
      "aten.new_ones.default",
      {
        "dtype": "torch.bool",
        "out_dtype": "bool",
        "out_rank": 0,
        "size": []
      },
      3
    ],
    [
      "aten.silu.default",
      {
        "out_dtype": "f32",
        "out_rank": 3
      },
      7
    ],
    [
      "aten.softmax.int",
      {
        "dim": -1,
        "dtype": null,
        "out_dtype": "f32",
        "out_rank": 4
      },
      8
    ],
    [
      "aten.transpose.int",
      {
        "dim0": 1,
        "dim1": 2,
        "out_dtype": "f32",
        "out_rank": 4
      },
      32
    ],
    [
      "aten.transpose.int",
      {
        "dim0": 2,
        "dim1": 3,
        "out_dtype": "f32",
        "out_rank": 4
      },
      8
    ],
    [
      "aten.unsqueeze.default",
      {
        "dim": 0,
        "out_dtype": "i64",
        "out_rank": 2
      },
      6
    ],
    [
      "aten.unsqueeze.default",
      {
        "dim": 1,
        "out_dtype": "i64",
        "out_rank": 2
      },
      3
    ],
    [
      "aten.unsqueeze.default",
      {
        "dim": 1,
        "out_dtype": "i64",
        "out_rank": 3
      },
      6
    ],
    [
      "aten.unsqueeze.default",
      {
        "dim": 2,
        "out_dtype": "i64",
        "out_rank": 3
      },
      3
    ],
    [
      "aten.unsqueeze.default",
      {
        "dim": 2,
        "out_dtype": "i64",
        "out_rank": 4
      },
      3
    ],
    [
      "aten.unsqueeze.default",
      {
        "dim": 3,
        "out_dtype": "i64",
        "out_rank": 4
      },
      6
    ],
    [
      "aten.view.default",
      {
        "out_dtype": "f32",
        "out_rank": 3,
        "size": [
          1,
          16,
          -1
        ]
      },
      6
    ],
    [
      "aten.view.default",
      {
        "out_dtype": "f32",
        "out_rank": 3,
        "size": [
          1,
          4,
          -1
        ]
      },
      2
    ],
    [
      "aten.view.default",
      {
        "out_dtype": "f32",
        "out_rank": 4,
        "size": [
          1,
          16,
          -1,
          8
        ]
      },
      20
    ],
    [
      "aten.view.default",
      {
        "out_dtype": "f32",
        "out_rank": 4,
        "size": [
          1,
          4,
          -1,
          8
        ]
      },
      4
    ],
    [
      "aten.where.ScalarOther",
      {
        "other": -3.4028234663852886e+38,
        "out_dtype": "f32",
        "out_rank": 4
      },
      3
    ]
  ],
  "schema_version": 1
}
