{
  "counts": {
    "aten.__and__.Tensor": 2,
    "aten._assert_tensor_metadata.default": 19,
    "aten._to_copy.default": 2,
    "aten._unsafe_view.default": 4,
    "aten.add.Tensor": 18,
    "aten.alias.default": 1,
    "aten.arange.default": 4,
    "aten.cat.default": 9,
    "aten.clone.default": 13,
    "aten.cos.default": 1,
    "aten.embedding.default": 1,
    "aten.expand.default": 6,
    "aten.index.Tensor": 1,
    "aten.le.Tensor": 1,
    "aten.linear.default": 15,
    "aten.matmul.default": 5,
    "aten.mean.dim": 5,
    "aten.mul.Tensor": 24,
    "aten.neg.default": 4,
    "aten.new_ones.default": 1,
    "aten.pow.Tensor_Scalar": 5,
    "aten.rsqrt.default": 5,
    "aten.silu.default": 2,
    "aten.sin.default": 1,
    "aten.slice.Tensor": 8,
    "aten.softmax.int": 2,
    "aten.transpose.int": 11,
    "aten.unsqueeze.default": 21,
    "aten.view.default": 8,
    "aten.where.ScalarOther": 1
  },
  "dialect": "functional",
  "graph_sha256": "81b09abb9b6088f4c6decd064e9ff33bb5e1c5552806a43c5d5844dc2d5bea22",
  "ops": [
    [
      "aten.__and__.Tensor",
      {
        "out_dtype": "bool",
        "out_rank": 4
      },
      2
    ],
    [
      "aten._to_copy.default",
      {
        "dtype": "torch.bool",
        "memory_format": null,
        "non_blocking": false,
        "out_dtype": "bool",
        "out_rank": 2
      },
      1
    ],
    [
      "aten._to_copy.default",
      {
        "dtype": "torch.float32",
        "memory_format": null,
        "non_blocking": false,
        "out_dtype": "f32",
        "out_rank": 3
      },
      1
    ],
    [
      "aten._unsafe_view.default",
      {
        "out_dtype": "f32",
        "out_rank": 4,
        "size": [
          1,
          4,
          4,
          16
        ]
      },
      4
    ],
    [
      "aten.add.Tensor",
      {
        "alpha": 1,
        "out_dtype": "f32",
        "out_rank": 3
      },
      9
    ],
    [
      "aten.add.Tensor",
      {
        "alpha": 1,
        "out_dtype": "f32",
        "out_rank": 4
      },
      6
    ],
    [
      "aten.add.Tensor",
      {
        "alpha": 1,
        "out_dtype": "i64",
        "out_rank": 1
      },
      3
    ],
    [
      "aten.alias.default",
      {
        "out_dtype": "f32",
        "out_rank": 3
      },
      1
    ],
    [
      "aten.arange.default",
      {
        "dtype": null,
        "end": 1,
        "out_dtype": "i64",
        "out_rank": 1
      },
      1
    ],
    [
      "aten.arange.default",
      {
        "dtype": null,
        "end": 4,
        "out_dtype": "i64",
        "out_rank": 1
      },
      3
    ],
    [
      "aten.cat.default",
      {
        "dim": -1,
        "out_dtype": "f32",
        "out_rank": 3
      },
      1
    ],
    [
      "aten.cat.default",
      {
        "dim": -1,
        "out_dtype": "f32",
        "out_rank": 4
      },
      4
    ],
    [
      "aten.cat.default",
      {
        "dim": -2,
        "out_dtype": "f32",
        "out_rank": 4
      },
      4
    ],
    [
      "aten.clone.default",
      {
        "memory_format": "torch.contiguous_format",
        "out_dtype": "f32",
        "out_rank": 4
      },
      2
    ],
    [
      "aten.clone.default",
      {
        "memory_format": "torch.contiguous_format",
        "out_dtype": "f32",
        "out_rank": 5
      },
      4
    ],
    [
      "aten.clone.default",
      {
        "memory_format": null,
        "out_dtype": "f32",
        "out_rank": 0
      },
      1
    ],
    [
      "aten.clone.default",
      {
        "memory_format": null,
        "out_dtype": "f32",
        "out_rank": 1
      },
      4
    ],
    [
      "aten.clone.default",
      {
        "memory_format": null,
        "out_dtype": "f32",
        "out_rank": 4
      },
      2
    ],
    [
      "aten.cos.default",
      {
        "out_dtype": "f32",
        "out_rank": 3
      },
      1
    ],
    [
      "aten.embedding.default",
      {
        "out_dtype": "f32",
        "out_rank": 3,
        "padding_idx": 0,
        "scale_grad_by_freq": false,
        "sparse": false
      },
      1
    ],
    [
      "aten.expand.default",
      {
        "implicit": false,
        "out_dtype": "bool",
        "out_rank": 4,
        "size": [
          1,
          -1,
          4,
          4
        ]
      },
      1
    ],
    [
      "aten.expand.default",
      {
        "implicit": false,
        "out_dtype": "f32",
        "out_rank": 3,
        "size": [
          1,
          -1,
          1
        ]
      },
      1
    ],
    [
      "aten.expand.default",
      {
        "implicit": false,
        "out_dtype": "f32",
        "out_rank": 5,
        "size": [
          1,
          2,
          2,
          4,
          16
        ]
      },
      4
    ],
    [
      "aten.index.Tensor",
      {
        "out_dtype": "bool",
        "out_rank": 4
      },
      1
    ],
    [
      "aten.le.Tensor",
      {
        "out_dtype": "bool",
        "out_rank": 4
      },
      1
    ],
    [
      "aten.linear.default",
      {
        "out_dtype": "f32",
        "out_rank": 3
      },
      15
    ],
    [
      "aten.matmul.default",
      {
        "out_dtype": "f32",
        "out_rank": 3
      },
      1
    ],
    [
      "aten.matmul.default",
      {
        "out_dtype": "f32",
        "out_rank": 4
      },
      4
    ],
    [
      "aten.mean.dim",
      {
        "dim": [
          -1
        ],
        "dtype": null,
        "keepdim": true,
        "out_dtype": "f32",
        "out_rank": 3
      },
      5
    ],
    [
      "aten.mul.Tensor",
      {
        "out_dtype": "f32",
        "out_rank": 3
      },
      14
    ],
    [
      "aten.mul.Tensor",
      {
        "out_dtype": "f32",
        "out_rank": 4
      },
      10
    ],
    [
      "aten.neg.default",
      {
        "out_dtype": "f32",
        "out_rank": 4
      },
      4
    ],
    [
      "aten.new_ones.default",
      {
        "dtype": "torch.bool",
        "out_dtype": "bool",
        "out_rank": 0,
        "size": []
      },
      1
    ],
    [
      "aten.pow.Tensor_Scalar",
      {
        "exponent": 2,
        "out_dtype": "f32",
        "out_rank": 3
      },
      5
    ],
    [
      "aten.rsqrt.default",
      {
        "out_dtype": "f32",
        "out_rank": 3
      },
      5
    ],
    [
      "aten.silu.default",
      {
        "out_dtype": "f32",
        "out_rank": 3
      },
      2
    ],
    [
      "aten.sin.default",
      {
        "out_dtype": "f32",
        "out_rank": 3
      },
      1
    ],
    [
      "aten.slice.Tensor",
      {
        "dim": 3,
        "end": 8,
        "out_dtype": "f32",
        "out_rank": 4,
        "start": 0,
        "step": 1
      },
      4
    ],
    [
      "aten.slice.Tensor",
      {
        "dim": 3,
        "end": 9223372036854775807,
        "out_dtype": "f32",
        "out_rank": 4,
        "start": 8,
        "step": 1
      },
      4
    ],
    [
      "aten.softmax.int",
      {
        "dim": -1,
        "dtype": "torch.float32",
        "out_dtype": "f32",
        "out_rank": 4
      },
      2
    ],
    [
      "aten.transpose.int",
      {
        "dim0": 1,
        "dim1": 2,
        "out_dtype": "f32",
        "out_rank": 3
      },
      1
    ],
    [
      "aten.transpose.int",
      {
        "dim0": 1,
        "dim1": 2,
        "out_dtype": "f32",
        "out_rank": 4
      },
      8
    ],
    [
      "aten.transpose.int",
      {
        "dim0": 2,
        "dim1": 3,
        "out_dtype": "f32",
        "out_rank": 4
      },
      2
    ],
    [
      "aten.unsqueeze.default",
      {
        "dim": 0,
        "out_dtype": "f32",
        "out_rank": 2
      },
      1
    ],
    [
      "aten.unsqueeze.default",
      {
        "dim": 0,
        "out_dtype": "i64",
        "out_rank": 2
      },
      3
    ],
    [
      "aten.unsqueeze.default",
      {
        "dim": 1,
        "out_dtype": "f32",
        "out_rank": 4
      },
      4
    ],
    [
      "aten.unsqueeze.default",
      {
        "dim": 1,
        "out_dtype": "i64",
        "out_rank": 2
      },
      1
    ],
    [
      "aten.unsqueeze.default",
      {
        "dim": 1,
        "out_dtype": "i64",
        "out_rank": 3
      },
      3
    ],
    [
      "aten.unsqueeze.default",
      {
        "dim": 2,
        "out_dtype": "f32",
        "out_rank": 3
      },
      1
    ],
    [
      "aten.unsqueeze.default",
      {
        "dim": 2,
        "out_dtype": "f32",
        "out_rank": 5
      },
      4
    ],
    [
      "aten.unsqueeze.default",
      {
        "dim": 2,
        "out_dtype": "i64",
        "out_rank": 3
      },
      1
    ],
    [
      "aten.unsqueeze.default",
      {
        "dim": 2,
        "out_dtype": "i64",
        "out_rank": 4
      },
      1
    ],
    [
      "aten.unsqueeze.default",
      {
        "dim": 3,
        "out_dtype": "i64",
        "out_rank": 4
      },
      2
    ],
    [
      "aten.view.default",
      {
        "out_dtype": "f32",
        "out_rank": 3,
        "size": [
          1,
          4,
          -1
        ]
      },
      2
    ],
    [
      "aten.view.default",
      {
        "out_dtype": "f32",
        "out_rank": 4,
        "size": [
          1,
          4,
          -1,
          16
        ]
      },
      6
    ],
    [
      "aten.where.ScalarOther",
      {
        "other": -3.4028234663852886e+38,
        "out_dtype": "f32",
        "out_rank": 4
      },
      1
    ]
  ],
  "schema_version": 1
}
