{
  "counts": {
    "aten.__and__.Tensor": 2,
    "aten._assert_tensor_metadata.default": 6,
    "aten._to_copy.default": 1,
    "aten._unsafe_view.default": 2,
    "aten.add.Tensor": 14,
    "aten.addmm.default": 8,
    "aten.alias.default": 1,
    "aten.arange.default": 4,
    "aten.clone.default": 10,
    "aten.embedding.default": 2,
    "aten.expand.default": 1,
    "aten.index.Tensor": 1,
    "aten.layer_norm.default": 5,
    "aten.le.Tensor": 1,
    "aten.linear.default": 1,
    "aten.matmul.default": 4,
    "aten.mul.Tensor": 10,
    "aten.new_ones.default": 1,
    "aten.pow.Tensor_Scalar": 2,
    "aten.softmax.int": 2,
    "aten.split.Tensor": 2,
    "aten.tanh.default": 2,
    "aten.transpose.int": 10,
    "aten.unsqueeze.default": 10,
    "aten.view.default": 25,
    "aten.where.ScalarOther": 1
  },
  "dialect": "functional",
  "graph_sha256": "a821b6117b264fda8258f4c1a5f1423918b8cff127de2cc5f8cb780134b42ffb",
  "ops": [
    [
      "aten.__and__.Tensor",
      {
        "out_dtype": "bool",
        "out_rank": 4
      },
      2
    ],
    [
      "aten._to_copy.default",
      {
        "dtype": "torch.bool",
        "memory_format": null,
        "non_blocking": false,
        "out_dtype": "bool",
        "out_rank": 2
      },
      1
    ],
    [
      "aten._unsafe_view.default",
      {
        "out_dtype": "f32",
        "out_rank": 3,
        "size": [
          1,
          16,
          32
        ]
      },
      2
    ],
    [
      "aten.add.Tensor",
      {
        "alpha": 1,
        "out_dtype": "f32",
        "out_rank": 3
      },
      9
    ],
    [
      "aten.add.Tensor",
      {
        "alpha": 1,
        "out_dtype": "f32",
        "out_rank": 4
      },
      2
    ],
    [
      "aten.add.Tensor",
      {
        "alpha": 1,
        "out_dtype": "i64",
        "out_rank": 1
      },
      3
    ],
    [
      "aten.addmm.default",
      {
        "alpha": 1,
        "beta": 1,
        "out_dtype": "f32",
        "out_rank": 2
      },
      8
    ],
    [
      "aten.alias.default",
      {
        "out_dtype": "f32",
        "out_rank": 3
      },
      1
    ],
    [
      "aten.arange.default",
      {
        "dtype": null,
        "end": 1,
        "out_dtype": "i64",
        "out_rank": 1
      },
      1
    ],
    [
      "aten.arange.default",
      {
        "dtype": null,
        "end": 16,
        "out_dtype": "i64",
        "out_rank": 1
      },
      3
    ],
    [
      "aten.clone.default",
      {
        "memory_format": "torch.contiguous_format",
        "out_dtype": "f32",
        "out_rank": 4
      },
      2
    ],
    [
      "aten.clone.default",
      {
        "memory_format": null,
        "out_dtype": "f32",
        "out_rank": 0
      },
      1
    ],
    [
      "aten.clone.default",
      {
        "memory_format": null,
        "out_dtype": "f32",
        "out_rank": 3
      },
      5
    ],
    [
      "aten.clone.default",
      {
        "memory_format": null,
        "out_dtype": "f32",
        "out_rank": 4
      },
      2
    ],
    [
      "aten.embedding.default",
      {
        "out_dtype": "f32",
        "out_rank": 3,
        "padding_idx": -1,
        "scale_grad_by_freq": false,
        "sparse": false
      },
      2
    ],
    [
      "aten.expand.default",
      {
        "implicit": false,
        "out_dtype": "bool",
        "out_rank": 4,
        "size": [
          1,
          -1,
          16,
          16
        ]
      },
      1
    ],
    [
      "aten.index.Tensor",
      {
        "out_dtype": "bool",
        "out_rank": 4
      },
      1
    ],
    [
      "aten.layer_norm.default",
      {
        "cudnn_enable": false,
        "eps": 1e-05,
        "normalized_shape": [
          32
        ],
        "out_dtype": "f32",
        "out_rank": 3
      },
      5
    ],
    [
      "aten.le.Tensor",
      {
        "out_dtype": "bool",
        "out_rank": 4
      },
      1
    ],
    [
      "aten.linear.default",
      {
        "out_dtype": "f32",
        "out_rank": 3
      },
      1
    ],
    [
      "aten.matmul.default",
      {
        "out_dtype": "f32",
        "out_rank": 4
      },
      4
    ],
    [
      "aten.mul.Tensor",
      {
        "out_dtype": "f32",
        "out_rank": 3
      },
      8
    ],
    [
      "aten.mul.Tensor",
      {
        "out_dtype": "f32",
        "out_rank": 4
      },
      2
    ],
    [
      "aten.new_ones.default",
      {
        "dtype": "torch.bool",
        "out_dtype": "bool",
        "out_rank": 0,
        "size": []
      },
      1
    ],
    [
      "aten.pow.Tensor_Scalar",
      {
        "exponent": 3.0,
        "out_dtype": "f32",
        "out_rank": 3
      },
      2
    ],
    [
      "aten.softmax.int",
      {
        "dim": -1,
        "dtype": null,
        "out_dtype": "f32",
        "out_rank": 4
      },
      2
    ],
    [
      "aten.split.Tensor",
      {
        "dim": 2,
        "out_dtype": "f32",
        "out_rank": 3,
        "split_size": 32
      },
      2
    ],
    [
      "aten.tanh.default",
      {
        "out_dtype": "f32",
        "out_rank": 3
      },
      2
    ],
    [
      "aten.transpose.int",
      {
        "dim0": -1,
        "dim1": -2,
        "out_dtype": "f32",
        "out_rank": 4
      },
      2
    ],
    [
      "aten.transpose.int",
      {
        "dim0": 1,
        "dim1": 2,
        "out_dtype": "f32",
        "out_rank": 4
      },
      8
    ],
    [
      "aten.unsqueeze.default",
      {
        "dim": 0,
        "out_dtype": "i64",
        "out_rank": 2
      },
      3
    ],
    [
      "aten.unsqueeze.default",
      {
        "dim": 1,
        "out_dtype": "i64",
        "out_rank": 2
      },
      1
    ],
    [
      "aten.unsqueeze.default",
      {
        "dim": 1,
        "out_dtype": "i64",
        "out_rank": 3
      },
      2
    ],
    [
      "aten.unsqueeze.default",
      {
        "dim": 2,
        "out_dtype": "i64",
        "out_rank": 3
      },
      1
    ],
    [
      "aten.unsqueeze.default",
      {
        "dim": 2,
        "out_dtype": "i64",
        "out_rank": 4
      },
      1
    ],
    [
      "aten.unsqueeze.default",
      {
        "dim": 3,
        "out_dtype": "i64",
        "out_rank": 4
      },
      2
    ],
    [
      "aten.view.default",
      {
        "out_dtype": "f32",
        "out_rank": 2,
        "size": [
          -1,
          128
        ]
      },
      2
    ],
    [
      "aten.view.default",
      {
        "out_dtype": "f32",
        "out_rank": 2,
        "size": [
          -1,
          32
        ]
      },
      6
    ],
    [
      "aten.view.default",
      {
        "out_dtype": "f32",
        "out_rank": 3,
        "size": [
          -1,
          16,
          32
        ]
      },
      1
    ],
    [
      "aten.view.default",
      {
        "out_dtype": "f32",
        "out_rank": 3,
        "size": [
          1,
          16,
          128
        ]
      },
      2
    ],
    [
      "aten.view.default",
      {
        "out_dtype": "f32",
        "out_rank": 3,
        "size": [
          1,
          16,
          32
        ]
      },
      4
    ],
    [
      "aten.view.default",
      {
        "out_dtype": "f32",
        "out_rank": 3,
        "size": [
          1,
          16,
          96
        ]
      },
      2
    ],
    [
      "aten.view.default",
      {
        "out_dtype": "f32",
        "out_rank": 4,
        "size": [
          1,
          16,
          -1,
          8
        ]
      },
      6
    ],
    [
      "aten.view.default",
      {
        "out_dtype": "i64",
        "out_rank": 2,
        "size": [
          -1,
          16
        ]
      },
      1
    ],
    [
      "aten.view.default",
      {
        "out_dtype": "i64",
        "out_rank": 2,
        "size": [
          1,
          -1
        ]
      },
      1
    ],
    [
      "aten.where.ScalarOther",
      {
        "other": -3.4028234663852886e+38,
        "out_dtype": "f32",
        "out_rank": 4
      },
      1
    ]
  ],
  "schema_version": 1
}
