{
  "counts": {
    "aten.add.Tensor": 3,
    "aten.cat.default": 2,
    "aten.clone.default": 5,
    "aten.conv2d.default": 1,
    "aten.expand.default": 2,
    "aten.gelu.default": 1,
    "aten.layer_norm.default": 3,
    "aten.linear.default": 12,
    "aten.matmul.default": 2,
    "aten.mul.Tensor": 1,
    "aten.relu.default": 4,
    "aten.select.int": 1,
    "aten.sigmoid.default": 1,
    "aten.slice.Tensor": 3,
    "aten.softmax.int": 1,
    "aten.transpose.int": 8,
    "aten.unsqueeze.default": 1,
    "aten.upsample_bicubic2d.vec": 1,
    "aten.view.default": 7
  },
  "dialect": "functional",
  "graph_sha256": "15b4f4dd083f711680a4055d274a3b240dfc36049ada93daaa9c326d511b46f3",
  "ops": [
    [
      "aten.add.Tensor",
      {
        "alpha": 1,
        "out_dtype": "f32",
        "out_rank": 3
      },
      3
    ],
    [
      "aten.cat.default",
      {
        "dim": 1,
        "out_dtype": "f32",
        "out_rank": 3
      },
      2
    ],
    [
      "aten.clone.default",
      {
        "memory_format": "torch.contiguous_format",
        "out_dtype": "f32",
        "out_rank": 4
      },
      1
    ],
    [
      "aten.clone.default",
      {
        "memory_format": null,
        "out_dtype": "f32",
        "out_rank": 3
      },
      3
    ],
    [
      "aten.clone.default",
      {
        "memory_format": null,
        "out_dtype": "f32",
        "out_rank": 4
      },
      1
    ],
    [
      "aten.conv2d.default",
      {
        "depthwise": false,
        "dilation": [
          1,
          1
        ],
        "groups": 1,
        "kernel": [
          16,
          16
        ],
        "out_dtype": "f32",
        "out_rank": 4,
        "padding": [
          0,
          0
        ],
        "stride": [
          16,
          16
        ]
      },
      1
    ],
    [
      "aten.expand.default",
      {
        "implicit": false,
        "out_dtype": "f32",
        "out_rank": 3,
        "size": [
          1,
          -1,
          -1
        ]
      },
      2
    ],
    [
      "aten.gelu.default",
      {
        "approximate": "none",
        "out_dtype": "f32",
        "out_rank": 3
      },
      1
    ],
    [
      "aten.layer_norm.default",
      {
        "cudnn_enable": false,
        "eps": 1e-12,
        "normalized_shape": [
          64
        ],
        "out_dtype": "f32",
        "out_rank": 3
      },
      3
    ],
    [
      "aten.linear.default",
      {
        "out_dtype": "f32",
        "out_rank": 3
      },
      12
    ],
    [
      "aten.matmul.default",
      {
        "out_dtype": "f32",
        "out_rank": 4
      },
      2
    ],
    [
      "aten.mul.Tensor",
      {
        "out_dtype": "f32",
        "out_rank": 4
      },
      1
    ],
    [
      "aten.relu.default",
      {
        "out_dtype": "f32",
        "out_rank": 3
      },
      4
    ],
    [
      "aten.select.int",
      {
        "dim": 1,
        "index": 0,
        "out_dtype": "f32",
        "out_rank": 2
      },
      1
    ],
    [
      "aten.sigmoid.default",
      {
        "out_dtype": "f32",
        "out_rank": 3
      },
      1
    ],
    [
      "aten.slice.Tensor",
      {
        "dim": 1,
        "end": -10,
        "out_dtype": "f32",
        "out_rank": 3,
        "start": 1,
        "step": 1
      },
      1
    ],
    [
      "aten.slice.Tensor",
      {
        "dim": 1,
        "end": 9223372036854775807,
        "out_dtype": "f32",
        "out_rank": 3,
        "start": -10,
        "step": 1
      },
      2
    ],
    [
      "aten.softmax.int",
      {
        "dim": -1,
        "dtype": null,
        "out_dtype": "f32",
        "out_rank": 4
      },
      1
    ],
    [
      "aten.transpose.int",
      {
        "dim0": 1,
        "dim1": 2,
        "out_dtype": "f32",
        "out_rank": 3
      },
      3
    ],
    [
      "aten.transpose.int",
      {
        "dim0": 1,
        "dim1": 2,
        "out_dtype": "f32",
        "out_rank": 4
      },
      4
    ],
    [
      "aten.transpose.int",
      {
        "dim0": 2,
        "dim1": 3,
        "out_dtype": "f32",
        "out_rank": 4
      },
      1
    ],
    [
      "aten.unsqueeze.default",
      {
        "dim": 1,
        "out_dtype": "f32",
        "out_rank": 3
      },
      1
    ],
    [
      "aten.upsample_bicubic2d.vec",
      {
        "align_corners": false,
        "out_dtype": "f32",
        "out_rank": 4,
        "output_size": [
          14,
          14
        ],
        "scale_factors": null
      },
      1
    ],
    [
      "aten.view.default",
      {
        "out_dtype": "f32",
        "out_rank": 3,
        "size": [
          1,
          207,
          64
        ]
      },
      1
    ],
    [
      "aten.view.default",
      {
        "out_dtype": "f32",
        "out_rank": 3,
        "size": [
          1,
          64,
          196
        ]
      },
      2
    ],
    [
      "aten.view.default",
      {
        "out_dtype": "f32",
        "out_rank": 4,
        "size": [
          1,
          -1,
          2,
          32
        ]
      },
      3
    ],
    [
      "aten.view.default",
      {
        "out_dtype": "f32",
        "out_rank": 4,
        "size": [
          1,
          64,
          14,
          14
        ]
      },
      1
    ]
  ],
  "schema_version": 1
}
